{
  "schemaVersion": 1,
  "deno": {
    "version": "2.9.3"
  },
  "codex": {
    "cliVersion": "0.145.0",
    "versionOutput": "codex-cli 0.145.0",
    "appServerArgs": [
      "app-server",
      "--stdio"
    ]
  },
  "generation": {
    "mode": "stable",
    "typesCommand": [
      "app-server",
      "generate-ts",
      "--out",
      "{output}"
    ],
    "jsonSchemaCommand": [
      "app-server",
      "generate-json-schema",
      "--out",
      "{output}"
    ],
    "generatedRoot": "spikes/codex-app-server/generated/0.145.0",
    "bundleSha256": "f6704018971b3b5e4ea0ffcd3e73b8d7dee4fd50435ed59467639936cb0e19c1"
  },
  "validationPlatform": {
    "os": "darwin",
    "arch": "aarch64",
    "cleanupStrategy": "unix-process-group-v1"
  },
  "limits": {
    "maxStdoutLineBytes": 16777216,
    "maxStderrBytes": 1048576,
    "maxQueueMessages": 1024,
    "maxQueueBytes": 16777216,
    "maxModelPages": 100,
    "initializeMs": 30000,
    "modelCatalogMs": 60000,
    "firstTurnEventMs": 60000,
    "turnCompletionMs": 600000,
    "gracefulExitMs": 2000,
    "terminateExitMs": 2000,
    "forceExitMs": 2000
  }
}
